{
  "schema_version": "1.0",
  "trial_id": "trial-05",
  "run_id": "2026-07-14T05-16-25_java_quarkus_jvm-java25_cold-start-api_run-set",
  "status": "valid",
  "started_at": "2026-07-14T05:19:49.775827Z",
  "finished_at": "2026-07-14T05:20:26.845488Z",
  "manifest_digest": "ba30dffa62827b01b9a55bb9be5d3d44e6019c58b3313870f602a202dcf2ffec",
  "cohort_fingerprint": "d6ee0866d61e341008c1c592ef319ed4357f5f2276bd848bd5d404af66e59e0c",
  "summary": [
    {
      "name": "dependency_ready_ms",
      "unit": "milliseconds",
      "value": 0,
      "source_artifacts": [
        "startup.json"
      ]
    },
    {
      "name": "ready_ms",
      "unit": "milliseconds",
      "value": 1270,
      "source_artifacts": [
        "startup.json"
      ]
    },
    {
      "name": "entrypoint_pre_exec_to_first_valid_response_ms",
      "unit": "milliseconds",
      "value": 1270,
      "source_artifacts": [
        "startup.json"
      ]
    },
    {
      "name": "first_request_ms",
      "unit": "milliseconds",
      "value": 70.0,
      "source_artifacts": [
        "startup.json"
      ]
    }
  ],
  "time_series": {
    "path": "time-series.json",
    "sha256": "892edb10a93081c9c16322e1f95a8701d9dca786e3b7c1aeb1f63451947e071b"
  },
  "artifact_manifest": {
    "path": "artifact-manifest.json",
    "sha256": "f63d5b43280806ccc560a99ad04011e242782db7b0c0ef64e3597414cfc02b90"
  }
}
