{
  "schema_version": "1.0",
  "trial_id": "trial-01",
  "run_id": "2026-07-13T14-16-22_java_quarkus_jvm-java25_transactional-command-api_run-set",
  "status": "valid",
  "started_at": "2026-07-13T14:17:02.208865Z",
  "finished_at": "2026-07-13T14:27:18.125149Z",
  "manifest_digest": "fde0266cbd5cc47bd90caa458a6c30599a20b35863b09740035645d9baeb1847",
  "cohort_fingerprint": "6b5916457ef2c0952030bc86686e25b90801dfd3a63d91abb8642e79fa7d9fa9",
  "summary": [
    {
      "name": "rps",
      "unit": "requests_per_second",
      "value": 199.99951884240755,
      "source_artifacts": [
        "k6-summary.json"
      ]
    },
    {
      "name": "p50_ms",
      "unit": "milliseconds",
      "value": 2.704902,
      "source_artifacts": [
        "k6-summary.json"
      ]
    },
    {
      "name": "p95_ms",
      "unit": "milliseconds",
      "value": 2.9901336,
      "source_artifacts": [
        "k6-summary.json"
      ]
    },
    {
      "name": "p99_ms",
      "unit": "milliseconds",
      "value": 3.2484813,
      "source_artifacts": [
        "k6-summary.json"
      ]
    },
    {
      "name": "error_rate",
      "unit": "ratio",
      "value": 0,
      "source_artifacts": [
        "k6-summary.json"
      ]
    },
    {
      "name": "cpu_percent_avg",
      "unit": "percent",
      "value": 10.7525,
      "source_artifacts": [
        "kubelet-stats.json"
      ]
    },
    {
      "name": "cpu_percent_max",
      "unit": "percent",
      "value": 12.2006,
      "source_artifacts": [
        "kubelet-stats.json"
      ]
    },
    {
      "name": "memory_usage_max_bytes",
      "unit": "bytes",
      "value": 271388672,
      "source_artifacts": [
        "kubelet-stats.json"
      ]
    },
    {
      "name": "dependency_ready_ms",
      "unit": "milliseconds",
      "value": 2048,
      "source_artifacts": [
        "startup.json"
      ]
    },
    {
      "name": "ready_ms",
      "unit": "milliseconds",
      "value": 2857,
      "source_artifacts": [
        "startup.json"
      ]
    },
    {
      "name": "first_request_ms",
      "unit": "milliseconds",
      "value": null,
      "source_artifacts": [
        "startup.json"
      ]
    }
  ],
  "time_series": {
    "path": "time-series.json",
    "sha256": "ddfddbde771b4b58e63a31b29d1722e920a916762ddba70cd0fb8ce6c4d6b43c"
  },
  "artifact_manifest": {
    "path": "artifact-manifest.json",
    "sha256": "aa8081bdc023070489415840650764a30b75cfc476b6442dde64c33c08637102"
  }
}
