{
  "schema_version": "1.0",
  "trial_id": "trial-01",
  "run_id": "2026-07-17T03-40-07_java_spring-boot_jvm-java25_cold-start-api_run-set",
  "status": "valid",
  "started_at": "2026-07-17T03:40:47.013460Z",
  "finished_at": "2026-07-17T03:41:23.812968Z",
  "manifest_digest": "d8764bb58a75413caaa86bbe342d58b394b7cc28c0994098f68c5ea90a712c2b",
  "cohort_fingerprint": "d6ee0866d61e341008c1c592ef319ed4357f5f2276bd848bd5d404af66e59e0c",
  "summary": [
    {
      "name": "dependency_ready_ms",
      "unit": "milliseconds",
      "value": 0,
      "source_artifacts": [
        "startup.json"
      ]
    },
    {
      "name": "ready_ms",
      "unit": "milliseconds",
      "value": 2518,
      "source_artifacts": [
        "startup.json"
      ]
    },
    {
      "name": "entrypoint_pre_exec_to_first_valid_response_ms",
      "unit": "milliseconds",
      "value": 2518,
      "source_artifacts": [
        "startup.json"
      ]
    },
    {
      "name": "first_request_ms",
      "unit": "milliseconds",
      "value": 89.0,
      "source_artifacts": [
        "startup.json"
      ]
    }
  ],
  "time_series": {
    "path": "time-series.json",
    "sha256": "f295f1378792ab5cb221fe662e12c81b48e83803b491cce6df51907c07d47324"
  },
  "artifact_manifest": {
    "path": "artifact-manifest.json",
    "sha256": "598ec084b0220101cb5c9c89e0a36c16362c151da71bc05d4e7803335c2c13c0"
  }
}
